Sheet: Summary
A1: Collabora Online calc test sample
A3: Month | B3: Profit | C3: Trend | E3: Raw data totals
A4: January | B4: 12000 | E4: USD | F4: of:=SUM([$RawData.J:$RawData.J]) -> 
A5: February | B5: 10000 | C5: of:=[.B4]-[.B5] -> 2000 | E5: GBP | F5: of:=SUM([$RawData.K:$RawData.K]) -> 
A6: March | B6: 9800 | C6: of:=[.B5]-[.B6] -> 200 | E6: EUR | F6: of:=SUM([$RawData.M:$RawData.M]) -> 
A7: April | B7: 13000 | C7: of:=[.B6]-[.B7] -> -3200
A8: May | B8: 13000 | C8: of:=[.B7]-[.B8] -> 0
A9: June | B9: 9800 | C9: of:=[.B8]-[.B9] -> 3200
A10: July | B10: 5400 | C10: of:=[.B9]-[.B10] -> 4400
A11: August | B11: 6700 | C11: of:=[.B10]-[.B11] -> -1300
A12: September | B12: 4300 | C12: of:=[.B11]-[.B12] -> 2400
A13: October | B13: 11000 | C13: of:=[.B12]-[.B13] -> -6700
A14: November | B14: 12500 | C14: of:=[.B13]-[.B14] -> -1500
A15: December | B15: 9800 | C15: of:=[.B14]-[.B15] -> 2700

Sheet: RawData
A1: Id | B1: First Name | C1: Last Name | D1: Gender | E1: Country | F1: n | G1: Date | H1: Id | I1: Percentage | J1: USD | K1: GBP | L1: GBP | M1: EUR
A2: %RAW_DATA% | B2: Dulce | C2: Abril | D2: Female | E2: United States | F2: 32 | G2: 15/10/2017 | H2: 1562 | I2: 34 | J2: 34 | K2: of:=[.J2]*0.8 -> 27.2 | L2: of:=[.K2]*0.8 -> 21.76 | M2: of:=[.J2]*0.93 -> 31.62

Sheet: 'file:///tmp/user/docs/jJe9ZwreWSf0zbuA/XEJCqJpZifXBxZZi/new-hello-world%20(1).fods/personal-financial-statement.xlsx'#Details
E65: 0
E66: 0
E68: 0
D71: 0 | E71: Maturity Date
E87: Frequency
G96: Payment
I103: 0